journal,priority,submission_role,fit_summary,major_risk,current_source_url,current_source_note,final_check_required
"BMC Medical Genomics","primary","Best fit if framed as medical genomics validation audit","Covers genomic research in relation to human health and disease, including neurogenomics, clinical genomics, and novel bioinformatics methods on medical data.","May require a clearer medical-genomics contribution beyond public-data reanalysis.","https://link.springer.com/journal/12920/aims-and-scope","Official scope includes functional genomics, neurogenomics, clinical genomics, and bioinformatics methods on medical data; BMC Series emphasizes scientific validity rather than perceived impact.","Confirm 2026 JCR/SCIE status, quartile, APC, word limits, and article type."
"BioData Mining","primary/backup","Best fit if framed as data-mining validation and model-transportability audit","Covers AI, machine learning, visual analytics, and knowledge discovery from high-dimensional biological and biomedical data.","May expect stronger computational or methodological novelty than a standard DEG validation paper.","https://link.springer.com/journal/13040/aims-and-scope","Official scope includes application/evaluation of data mining and machine-learning algorithms, preprocessing, modeling, interpretation, and biological knowledge discovery.","Confirm 2026 JCR/SCIE status, quartile, APC, and whether external-validation failure studies are acceptable."
"BMC Genomics","ambitious backup","Use only if manuscript emphasizes transcriptomics and validation standards","Covers genetics, genomics, transcriptomics and proteomics; BMC Series considers scientifically valid studies.","Likely higher novelty bar for a public-data AD blood reanalysis; risk of editorial rejection if contribution is mostly confirmatory.","https://link.springer.com/journal/12864/aims-and-scope","Official scope includes transcriptomics; BMC Series states manuscripts are judged by scientific validity, methodology, and standards.","Confirm 2026 JCR/SCIE status, quartile, APC, and fit with transcriptomic-methods section."
"Medicine","Q4-oriented broad backup","Use if framed as a broad biomedical validation study with transparent negative findings","Broad medical open-access journal indexed in Web of Science/JCR according to Wolters Kluwer OA journal list.","Scope is broad; pure bioinformatics papers may need strong clinical framing and transparent limitations.","https://www.wolterskluwer.com/en/solutions/open-access-at-wolters-kluwer-health/lippincott-open-access/journals","Wolters Kluwer lists Medicine as fully open access, broad medical, and indexed in Web of Science / ISI Journal Citation Reports.","Confirm latest JCR quartile, article type, APC, and whether public-transcriptomics reanalysis is acceptable."
"Genetics Research","backup with indexing caution","Use only after confirming current publisher/indexing status","Scope includes genomics, bioinformatics, computational studies, and disease genetics.","Publisher transition and indexing status require careful verification; not primary until confirmed.","https://www.cambridge.org/core/journals/genetics-research","Cambridge page notes the journal moved publisher after 2020 and describes scope including genomics, bioinformatics, and computational studies.","Confirm current active publisher, Web of Science/JCR inclusion, quartile, and manuscript handling status."
"BMC Research Notes","non-primary fallback","Only if downgraded to short negative/validation note","Explicitly welcomes valid negative results and short research observations across clinical and scientific disciplines.","May not satisfy SCI/Q3-Q4 target; use only as fallback if full article route fails.","https://link.springer.com/journal/13104/aims-and-scope","Official scope welcomes valid negative results, scientific datasets, short reports, and observations.","Confirm whether it has current SCIE/JCR coverage; likely not primary SCI target."
"Molecular Biology Reports","exclude for current manuscript","Do not submit unless wet-lab or molecular technique evidence is added","The project's pathway signal fits molecular biology topics, but the journal excludes purely bioinformatic / in silico papers.","Current manuscript is entirely public-data bioinformatics without wet-lab validation.","https://link.springer.com/journal/11033/aims-and-scope","Official scope says manuscripts need molecular/cell biology techniques and pure bioinformatic/in silico papers are not published.","Only reconsider if new experimental validation is added."
